{
  "task_id": "task_demo001",
  "schema_version": "1.0.0",
  "split": "train",
  "stratum": "投诉举报|环境保护|short",
  "source_document_id": "co_demo001",
  "source": {
    "representative_standard_order_id": "so_demo001",
    "service_object_type": "投诉举报",
    "case_content": "市民反映武进区阳光花园每天22时后有施工噪声，疑似由华建工程公司施工。",
    "case_goal": "希望住建部门核实并处理。",
    "title": null,
    "return_visit_reason": null,
    "remark": null,
    "appeal_result_opinions": null,
    "department_name": "受理科",
    "form_type": "噪声污染",
    "classification_l1": "环境保护",
    "classification_l2": "噪声污染",
    "classification_l3": "建筑施工噪声",
    "classification_l4": null,
    "classification_l5": null,
    "city": "常州市",
    "area": "武进区",
    "street": null,
    "order_source": "电话",
    "call_time": "2025-03-15 22:30:00",
    "case_complete_time": "2025-03-18 10:00:00",
    "order_finish_time": "2025-03-18 10:00:00",
    "quality_flags": "[]"
  },
  "annotations": {
    "events": [],
    "entities": [],
    "entity_mentions": [],
    "event_entity_relations": [],
    "event_event_relations": [],
    "warnings": []
  },
  "status": "unannotated",
  "annotator_id": null
}
